{
    "$schema": "../schema.json",
    "title": "Forge Disconnected",
    "description": "Sample Forge application using Service Workers and Cache APIs to provide a limited offline support.",
    "tags": [
        "viewer"
    ],
    "screenshotUrl": "https://via.placeholder.com/400x200.png",
    "liveDemoUrl": "https://forge-disconnected.autodesk.io",
    "sourceUrl": "https://github.com/petrbroz/forge-disconnected"
}