{
    "$schema": "../schema.json",
    "title": "BIM360 Model Coordination: Clash Export",
    "description": "This repository demonstrates advanced viewing of clash raw data by Model Coordination API and demos exporting a PDF report on the clashes the user is interested in.",
    "tags": [
        "bim360"
    ],
    "screenshotUrl": "https://github.com/Autodesk-Forge/forge-bim360-clashpdfexport/raw/master/thumbnail.png",
    "sourceUrl": "https://github.com/Autodesk-Forge/forge-bim360-clashpdfexport",
    "liveDemoUrl": "https://bim360-clash-pdf-exporter.herokuapp.com"
}