{
    "$schema": "../schema.json",
    "title": "Forge Industrial Construction",
    "description": "Autodesk Forge application demonstrating possible usage in industrial construction.",
    "tags": [
        "viewer",
        "digital twin"
    ],
    "screenshotUrl": "https://via.placeholder.com/400x200.png",
    "liveDemoUrl": "https://forge-industrial-construction.autodesk.io/",
    "sourceUrl": "https://github.com/petrbroz/forge-industrial-construction"
}